{
  "$schema": "https://json-schema.org/draft/2020-12/schema",
  "$id": "https://github.com/code-assurance-initiative/scanner-benchmark/schema/answer-key.schema.json",
  "title": "Scanner benchmark answer key",
  "description": "The labels of one benchmark repository (docs/CONTRACT.md, v1.2). Labels are not outcomes: TP/FP/TN/FN are produced by scoring a scanner run against these labels. Constraints JSON Schema cannot express (unique entry ids, concepts that exist in taxonomy.json, cwe agreeing with the taxonomy, must-fire/must-not-fire/clean entries that collide on one concept and site) are enforced by `python3 -m cai_bench validate`.",
  "type": "object",
  "additionalProperties": false,
  "required": [
    "schemaVersion",
    "repo",
    "keyVersion",
    "entries"
  ],
  "properties": {
    "$schema": {
      "type": "string"
    },
    "schema": {
      "type": "string"
    },
    "schemaVersion": {
      "enum": [
        "1.0",
        "1.1",
        "1.2"
      ]
    },
    "repo": {
      "type": "string",
      "pattern": "^[A-Za-z0-9_.-]+/[A-Za-z0-9_.-]+$"
    },
    "keyVersion": {
      "type": "string",
      "pattern": "^\\d+\\.\\d+\\.\\d+$"
    },
    "languages": {
      "type": "array",
      "items": {
        "type": "string",
        "minLength": 1
      },
      "uniqueItems": true
    },
    "theme": {
      "type": "string"
    },
    "lineTolerance": {
      "type": "integer",
      "minimum": 0,
      "default": 3
    },
    "entries": {
      "type": "array",
      "items": {
        "$ref": "#/$defs/entry"
      }
    }
  },
  "$defs": {
    "conceptId": {
      "type": "string",
      "pattern": "^[a-z0-9]+(-[a-z0-9]+)*$"
    },
    "entry": {
      "type": "object",
      "additionalProperties": false,
      "required": [
        "id",
        "label",
        "rationale"
      ],
      "properties": {
        "id": {
          "type": "string",
          "minLength": 1
        },
        "label": {
          "enum": [
            "must-fire",
            "must-not-fire",
            "clean",
            "not-applicable",
            "score-band"
          ]
        },
        "concept": {
          "$ref": "#/$defs/conceptId"
        },
        "concepts": {
          "oneOf": [
            {
              "const": "*"
            },
            {
              "type": "array",
              "minItems": 1,
              "uniqueItems": true,
              "items": {
                "$ref": "#/$defs/conceptId"
              }
            }
          ]
        },
        "cwe": {
          "type": "string",
          "pattern": "^CWE-[0-9]+$"
        },
        "file": {
          "type": "string",
          "minLength": 1
        },
        "lines": {
          "type": "array",
          "prefixItems": [
            {
              "type": "integer",
              "minimum": 1
            },
            {
              "type": "integer",
              "minimum": 1
            }
          ],
          "minItems": 2,
          "maxItems": 2,
          "$comment": "start <= end is checked by the validator (JSON Schema cannot compare two items)."
        },
        "commit": {
          "type": "string",
          "pattern": "^[0-9a-fA-F]{7,40}$",
          "description": "Contract 1.1: pins a history finding to a commit. The entry matches a result whose SARIF properties.commitSha starts with this (case-insensitive) in the same file, at any line. Only on must-fire / must-not-fire; requires file."
        },
        "subject": {
          "type": "string",
          "minLength": 1,
          "pattern": "\\S",
          "description": "Contract 1.2: what the entry is about when a scanner reports it without a site — a package id (NuGet/npm/…) or a framework moniker such as net6.0. Besides matching on its site, the entry matches a result of its concept that has no location or is located in a dependency manifest when the subject occurs in the result's message as a whole token, case-insensitive. Only on must-fire / must-not-fire / clean."
        },
        "band": {
          "type": "array",
          "prefixItems": [
            {
              "type": "number",
              "minimum": 0,
              "maximum": 100
            },
            {
              "type": "number",
              "minimum": 0,
              "maximum": 100
            }
          ],
          "minItems": 2,
          "maxItems": 2,
          "$comment": "min <= max is checked by the validator."
        },
        "rationale": {
          "type": "string",
          "minLength": 1
        },
        "scannerHints": {
          "type": "object",
          "$comment": "Informative only: scanner name -> rule ids expected to fire. The authoritative mapping is mappings/<scanner>.json in the harness.",
          "additionalProperties": {
            "type": "array",
            "items": {
              "type": "string",
              "minLength": 1
            }
          }
        }
      },
      "dependentRequired": {
        "lines": [
          "file"
        ],
        "commit": [
          "file"
        ]
      },
      "allOf": [
        {
          "if": {
            "properties": {
              "label": {
                "enum": [
                  "must-fire",
                  "must-not-fire",
                  "not-applicable"
                ]
              }
            },
            "required": [
              "label"
            ]
          },
          "then": {
            "required": [
              "concept"
            ],
            "not": {
              "anyOf": [
                {
                  "required": [
                    "concepts"
                  ]
                },
                {
                  "required": [
                    "band"
                  ]
                }
              ]
            }
          }
        },
        {
          "if": {
            "properties": {
              "label": {
                "const": "clean"
              }
            },
            "required": [
              "label"
            ]
          },
          "then": {
            "required": [
              "concepts"
            ],
            "not": {
              "anyOf": [
                {
                  "required": [
                    "concept"
                  ]
                },
                {
                  "required": [
                    "band"
                  ]
                },
                {
                  "required": [
                    "cwe"
                  ]
                }
              ]
            }
          }
        },
        {
          "if": {
            "properties": {
              "label": {
                "const": "score-band"
              }
            },
            "required": [
              "label"
            ]
          },
          "then": {
            "required": [
              "concept",
              "band"
            ],
            "not": {
              "anyOf": [
                {
                  "required": [
                    "concepts"
                  ]
                },
                {
                  "required": [
                    "file"
                  ]
                }
              ]
            }
          }
        },
        {
          "if": {
            "properties": {
              "label": {
                "enum": [
                  "clean",
                  "not-applicable",
                  "score-band"
                ]
              }
            },
            "required": [
              "label"
            ]
          },
          "then": {
            "not": {
              "required": [
                "commit"
              ]
            }
          }
        },
        {
          "if": {
            "properties": {
              "label": {
                "enum": [
                  "not-applicable",
                  "score-band"
                ]
              }
            },
            "required": [
              "label"
            ]
          },
          "then": {
            "not": {
              "required": [
                "subject"
              ]
            }
          }
        }
      ]
    }
  }
}
