{
  "schema": "https://github.com/code-assurance-initiative/scanner-benchmark/schema/answer-key.schema.json",
  "schemaVersion": "1.0",
  "repo": "code-assurance-initiative/bench-fixture",
  "keyVersion": "1.0.0",
  "languages": ["csharp"],
  "theme": "End-to-end fixture for the CLI test",
  "entries": [
    { "id": "SEC-001", "label": "must-fire", "concept": "hardcoded-credential", "cwe": "CWE-798", "file": "src/Billing/PaymentClient.cs", "lines": [14, 14], "rationale": "Literal secret key used at runtime." },
    { "id": "SEC-002", "label": "must-fire", "concept": "hardcoded-credential", "file": "src/Config/Defaults.cs", "lines": [30, 31], "rationale": "Literal password assigned to a connection string." },
    { "id": "TRP-001", "label": "must-not-fire", "concept": "hardcoded-credential", "file": "src/Billing/PaymentClient.cs", "lines": [40, 40], "rationale": "An environment-variable NAME, not a secret." },
    { "id": "CLN-001", "label": "clean", "concepts": "*", "file": "src/Billing/Invoice.cs", "rationale": "Plain domain type, nothing to find." },
    { "id": "NA-001", "label": "not-applicable", "concept": "sql-injection", "rationale": "No database access anywhere." },
    { "id": "BND-001", "label": "score-band", "concept": "security-policy-present", "band": [80, 100], "rationale": "SECURITY.md present." }
  ]
}
